"Analysis.group","Analysis.number","Analysis.name","Subgroup","Subgroup.number","Applicability","Study","Study.year","GIV.Mean","GIV.SE","Experimental.mean","Experimental.SD","Experimental.cases","Experimental.N","Control.mean","Control.SD","Control.cases","Control.N","O.E","Variance","Weight","Mean","CI.start","CI.end","Footnotes","Bias.arising.from.the.randomization.process.judgement","Bias.arising.from.the.randomization.process.support","Bias.due.to.deviations.from.intended.interventions.judgement","Bias.due.to.deviations.from.intended.interventions.support","Bias.due.to.missing.outcome.data.judgement","Bias.due.to.missing.outcome.data.support","Bias.in.measurement.of.the.outcome.judgement","Bias.in.measurement.of.the.outcome.support","Bias.in.selection.of.the.reported.result.judgement","Bias.in.selection.of.the.reported.result.support","Overall.bias.judgement","Overall.bias.support","review.url","review.doi","analysis_key","dataset_name","mismatch_type","direction_match","or_sig","rd_sig","log_or","rd","log_or_ci_lb","log_or_ci_ub","rd_ci_lb","rd_ci_ub","sparse_events","double_zero"
1,1,"Incidence of herpes zoster (up to 29.4 months after final dose)",NA,NA,"SUBGROUP_AND_OVERALL","Mullane 2019",2019,0,0.251379318752321,0,0,22,1328,0,0,61,1350,0,0.0631915618963811,0,0.36663,0.226523,0.593395,"Herpes zoster was confirmed by skin lesion PCR, or by adjustication of the clinical case description","Low risk","<p>Participants were randomised via central randomisation schedules by the trial statistician and the allocation sequence was concealed. There are no baseline differences that would suggest a problem with randomisation.</p>","Low risk","<p>Both participants and those delivering the intervention were unaware of the assigned intervention received and the analysis was appropriate.</p>","Low risk","<p>Data for this outcome was available for 2678 out of 2712 participants randomised.</p>","Low risk","<p>The measurement of the outcome was appropriate and it is unlikely that it differed between intervention groups. The outcome assessors were unaware of the intervention received.</p>","Low risk","<p>The data that produced this result was analysed and reported in accordance with the protocol.There was no indication for selection among multiple measurements or analyses.</p>","Low risk","<p>For this outcome, there is a low risk of bias for all the domains.</p>","https://www.cochranelibrary.com/cdsr/doi/10.1002/14651858.CD015551.pub2/full","10.1002/14651858.CD015551.pub2","1::overall","CD015551_pub2_data","significance_only",TRUE,FALSE,TRUE,-0.958014004721253,-0.0237351081096693,-1.9175138839287,0.00148587448618887,-0.0455862110110263,-0.00188400520831231,TRUE,FALSE
2,1,"All-cause mortality (up to 15 days post-surgery)",NA,NA,"SUBGROUP_AND_OVERALL","Goldmann 2015",2004,0,0,0,0,1,33,0,0,1,33,0,0,0,1,0.065253,15.325031,"","Some concerns","<p>There is no information on the randomisation method and the allocation concealment. There are no baseline differences that would suggest a problem with randomisation.</p>","Low risk","<p>Both participants and those delivering the intervention were probably unaware of the assigned intervention received and the analysis was appropriate.</p>","Some concerns","<p>Data for this outcome was available for 66 out of 75 participants randomised.</p>","Low risk","<p>The measurement of the outcome was probybly appropriate and it is unlikely that it differed between intervention groups. The outcome assessors were probably unaware of the intervention received.</p>","Some concerns","<p>According to the trial registry record, the outcome was not pre-specified as a primary or secondary outcome.</p>","Some concerns","<p>For this outcome, there is a low risk of bias due to deviations from intended interventions, and due to measurement of the outcome. However, there are some concerns for bias from the randomization process, due to missing outcome data, and due to selection of the reported results.</p>","https://www.cochranelibrary.com/cdsr/doi/10.1002/14651858.CD015551.pub2/full","10.1002/14651858.CD015551.pub2","1::overall","CD015551_pub2_data","significance_only",TRUE,FALSE,TRUE,-0.958014004721253,-0.0237351081096693,-1.9175138839287,0.00148587448618887,-0.0455862110110263,-0.00188400520831231,TRUE,FALSE
3,1,"Incidence of influenza (within 7 months)",NA,NA,"SUBGROUP_AND_OVERALL","INVIDIa-2",2020,0,0.165525111701257,0,0,51,581,0,0,47,607,0,0.0273985626037136,0,1.133665,0.77556,1.657121,"","","","","","","","","","","","","","https://www.cochranelibrary.com/cdsr/doi/10.1002/14651858.CD015551.pub2/full","10.1002/14651858.CD015551.pub2","1::overall","CD015551_pub2_data","significance_only",TRUE,FALSE,TRUE,-0.958014004721253,-0.0237351081096693,-1.9175138839287,0.00148587448618887,-0.0455862110110263,-0.00188400520831231,TRUE,FALSE
4,1,"Incidence of COVID-19 without previous infection (up to 6 months after second dose) ",NA,NA,"SUBGROUP_AND_OVERALL","Thomas 2022",2022,0,0,0,0,3,1054,0,0,39,1046,0,0.53476551911087,0,0.076339,0.023665,0.246255,"","Low risk","<p>Participants were randomised via the use of an IRT system and the allocation sequence was concealed. There are no baseline differences that would suggest a problem with randomisation.</p>","Low risk","<p>Both participants and those delivering the intervention were unaware of the assigned intervention received and the analysis was probably appropriate.</p>","Low risk","<p>Data for this outcome was available for 1054 participants in the intervention group and 1046 participants in the control group. There is no evidence that the result was not biased by missng data, but it is unlikely that missingness depend on its true value.</p>","Low risk","<p>The measurement of the outcome was appropriate and it is unlikely that it differed between intervention groups. The outcome assessors were unaware of the intervention received.</p>","Some concerns","<p>We have some concerns regarding selection of the reported results because of post hoc subgroup analyses that were not pre-defined at protocol stage. There was no indication for selection among multiple measurements or analyses.</p>","Some concerns","<p>For this outcome, there is a low risk of bias from the randomization process, due to deviations from intended interventions, due to missing outcomes and due to measurement of the outcome. However, there are some concerns for bias due to selection of the reported results.</p>","https://www.cochranelibrary.com/cdsr/doi/10.1002/14651858.CD015551.pub2/full","10.1002/14651858.CD015551.pub2","1::overall","CD015551_pub2_data","significance_only",TRUE,FALSE,TRUE,-0.958014004721253,-0.0237351081096693,-1.9175138839287,0.00148587448618887,-0.0455862110110263,-0.00188400520831231,TRUE,FALSE
5,1,"Incidence of COVID-19 (up to 16.3 months after at least one dose) ",NA,NA,"SUBGROUP_AND_OVERALL","Zhao 2024",2024,0,0.130604970198065,0,0,61,107,0,0,27,34,0,0.0170576582404374,0,0.717895,0.566179,0.910267,"","","","","","","","","","","","","","https://www.cochranelibrary.com/cdsr/doi/10.1002/14651858.CD015551.pub2/full","10.1002/14651858.CD015551.pub2","1::overall","CD015551_pub2_data","significance_only",TRUE,FALSE,TRUE,-0.958014004721253,-0.0237351081096693,-1.9175138839287,0.00148587448618887,-0.0455862110110263,-0.00188400520831231,TRUE,FALSE
